{"api_version":1,"bundle_sha256":"8668bcc959fb2374211855ec3d4bc455d58b6d4c3186f6625dceead979f3ab83","entry":"assets/app-QywrE71a.js","files":[{"bytes":323817,"cache_policy":"immutable","media_type":"text/javascript; charset=utf-8","path":"assets/app-QywrE71a.js","sha256":"337f643a7dd2b92b98d73af0e4a7ba7c54565703cace6ad72573c47000670530"},{"bytes":10517,"cache_policy":"immutable","media_type":"text/css; charset=utf-8","path":"assets/index-CIGGGO8r.css","sha256":"4e266e74b2abb09a101ca51b80a5fbcdf4b8a06744b94aeccc6f9d00f0425541"},{"bytes":650,"cache_policy":"no-store","media_type":"text/html; charset=utf-8","path":"index.html","sha256":"29394c88b8933bdee30b802322d42d61cc062b248537f247f33c8c9dae7adf21"}],"frontend_version":1,"index":"index.html","schema":"qlkg-frontend-bundle-v1"}
